,title,artist,lyrics
0,"Hey, Soul Sister",Train,"Hey, hey

Your lipstick stains on the front lobe of my left side brains
I knew I wouldn't forget you, and so I went and let you blow my mind
Your sweet moonbeam, the smell of you in every single dream I dream
I knew when we collided, you're the one I have decided who's one of my kind

Hey soul sister, ain't the Mr. Mister on the radio, stereo, the way you move ain't fair, you know!
Hey soul sister, I don't want to miss a single thing you do...tonight
Hey, hey

Just in time, I'm so glad you have a one-track mind like me
You gave my life direction, a game show love connection we can't deny
I'm so obsessed, my heart is bound to beat right out my untrimmed chest
I believe in you, like a virgin, you're Madonna, and I'm always gonna wanna blow your mind

Hey soul sister, ain't that Mr. Mister on the radio, stereo, the way you move ain't fair, you know!
Hey soul sister, I don't want to miss a single thing you do...tonight

The way you can't cut a rug, watching you's the only drug I need
You're so gangsta, I'm so thug, you're the only one I'm dreaming of
You see, I can be myself now finally, in fact there's nothing I can't be
I want the world to see you be with me

Hey soul sister, ain't that Mr. Mister on the radio, stereo, the way you move ain't fair, you know!
Hey soul sister, I don't want to miss a single thing you do tonight,
Hey soul sister, I don't want to miss a single thing you do...tonight
Hey, hey

Tonight
Hey, hey

Tonight "
1,Love The Way You Lie,Eminem,"Obie Trice:
You won't see me in the hood
It's cause I'm doing this, man

Niggas, I'm still grinding, (yeah)
I'm still hearing those sirens,
I'm still getting chased by those lights,
Only the light's lime and my mic's on
And my time is none because I'm writing more,
And I ain't here to meet a soul in this buisness,
I'm here to eat, speak, until these hoes feel this, (for sure)
and I can't let y'all derail me, man,
I got young Kobe, homie, you gotta let go of Obie
cause Obie be back, (ain't goin' nowhere man...)
We got them craps going on
and that yak going on,
soon as a nigga touch down back from tourin',
It's whateva, put that on the chedda man,
but in the meantime, it's Jimmy Iovine time,
chase cheese, rhyme till my voice give out,
this is it my niggas, this what we boast about,
Now I'm here so shut your motherfuckin mouth,
And show me love bitch..

Chorus:
I just wanna love ya for the rest of my life, (I dont love you bitch)
I wanna hold you in the morning,
hold you through the night

I just wanna love ya for the rest of my life, (We wanna love alcohol,
we wanna love guns, we wanna love money)
I wanna hold you in the morning,
hold you through the night.. (we don't wanna love bitches though)

Eminem:
There's a certain mystique when I speak,
that you notice that's sorta unique,
cause you know it's me, my poetry's deep,
and I'm still matic the way I flow to this beat,
you can't sit still, it's like tryin to smoke crack
and go to sleep, I'm strapped,
just knowing any minute I could snap,
I'm the equivalent of what would happen if Bush rapped,
I bully these rappers so bad lyrically,
it ain't even funny, I ain't even hungry,
it ain't even money, you can't pay me enough
for you to play me, it's cockamamie,
you just ain't zany enough to rock with Shady,
my noodle is cockadoodle, my clocks cuckoo,
I got screws loose, yeah, the whole kit 'n' kaboodle,
I'm just brutal
It's no rumor, I'm numero uno, assume it,
there's no humor in it no more, you know
I'm rollin with a swollen bowling ball in my bag,
you need a fag to come and tear a new hole in my ass
you better love me... bitch

Chorus:
I just wanna love ya for the rest of my life,
I wanna hold you in the morning,
hold you through the night

Obie Trice: and all the bitches say

I just wanna love ya for the rest of my life,
I wanna hold you in the morning,
hold you through the night

50 Cent:
my buzz is crazy in the hood, they holla my name,
if it ain't about the flow,
it's about the stones and the chain,
if I was you, I'd love me too,
I roll like a bus, 9-11 porsce same colour as cranberry sauce,
I ain't gonna front, I thought R-Kelly was tha shit,
then we find out he fucking round with bow wow bitch,
niggas eatin popcorn, right, rewinding the tape,
now shorty momma in the precinct hollerin rape,
i'm convinced man something really wrong with these hoes,
I thought L'il Kim was hot then she start fucking with her nose,
(God Damn)
used to listen to Lauren Hill and tap my feet,
then the bitch put out a CD that didn't have no beats, (uh-huh)
that boy D'Angelo he determined not to fail,
that nigga went butt-ass for his record to sell,
my back shot to help Ashanti hit them high notes,
and Big Ben taught Charlie B'more to deepthroat

Chorus:
I just wanna love ya for the rest of my life,
I wanna hold you in the morning, (I luv'a burnish the monies,
the bunnies I just wanna hold you)
hold you through the night

I just wanna love ya for the rest of my life,
I wanna hold you in the morning, (I just wanna love you)
hold you through the night."
2,TiK ToK,Kesha,
3,Bad Romance,Lady Gaga,"Ohhh...ohhh...ohhh
caught in a bad romance
Ohhh..ohhh..ohhh
caught in a bad romance

Rah-rah-ah-ah-ah
Roma, Roma-ma
GaGa, ooh la la
Want your bad romance

Rah-rah-ah-ah-ah
Roma, Roma-ma
GaGa, ooh la la
Want your bad romance

I want your ugly, I want your disease
I want your everything as long as it's free
I want your love, love, love, love
I want your love

I want your drama, the touch of your hand
I want your leather studded kiss in the scene
I want your love, love, love, love
I want your love
(Love, love, love, I want your love)

You know that I want you
And you know that I need you
I want a bad, bad romance

I want your love and I want your revenge
You and me could write a bad romance
I want your love and all your lover's revenge
You and me could write a bad romance
Ohhh....ohhhhh.....oohhh
Caught in a bad romance
ohhh....ohhhhh...oohhh
Caught in a bad romance

Rah-rah-ah-ah-ah
Roma, Roma-ma
GaGa, ooh la la
Want your bad romance

I want your horror, I want your design
'Cause you're a criminal as long as your mine
I want your love, love, love, love
I want your love

I want your psycho, your vertical stick
Want you in my room when your baby is sick
I want your love, love, love, love
I want your love
(Love, love, love, I want your love)

You know that I want you
And you know that I need you
('Cause I'm a free bitch, baby)
I want a bad, bad romance

I want your love and I want your revenge
You and me could write a bad romance
I want your love and all your lover's revenge
You and me could write a bad romance

Caught in a bad romance
Caught in a bad romance

Rah-rah-ah-ah-ah
Roma, Roma-ma
GaGa, ooh la la
Want your bad romance

Rah-rah-ah-ah-ah
Roma, Roma-ma
GaGa, ooh la la
Want your bad romance

Walk, walk fashion baby
Work it, move that bitch crazy
Walk walk fashion baby
Work it, move that bitch crazy

Walk, walk fashion baby
Work it, move that bitch crazy
Walk walk passion baby
Work it, I'm a free bitch baby

I want your love and I want your revenge
I want your love, I don't wanna be friends
Je veux ton amour et je veux ton revenge
Je veux ton amour

I don't want to be friends
(I want your bad romance, I want your bad romance)
I don't wanna be friends
(I want your bad romance, I want your bad romance)
(Caught in a bad romance)

I don't want to be friends
(I want your bad romance, I want your bad romance)
I don't wanna be friends
(I want your bad romance)
(Caught in a bad romance)
I want your bad romance

I want your love and I want your revenge
You and me could write a bad romance
I want your love and all your lover's revenge
You and me could write a bad romance

Want your bad romance
Caught in a bad romance
Want your bad romance
Want your bad romance
Caught in a bad romance

Rah-rah-ah-ah-ah
Roma, Roma-ma
GaGa, ooh la la
Want your bad romance"
4,Just the Way You Are,Bruno Mars,
5,Baby,Justin Bieber,"(Justin Bieber) 

You know you love me 
I know you care 
Just shout whenever, and I'll be there 
You want my love 
You want my heart 
And we would never, ever, ever be apart 

Are we an item? 
Girl quit playin' 
We're just friends, 
What are you sayin' 
Say there's another, and look right in my eyes 
My first love, broke my heart for the first time 

[Chorus] 

And now I'm like 
Baby, baby, baby ohh 
Like 
Baby, baby, baby noo 
Like 
Baby, baby, baby ohh 
I thought you'd always be mine, mine 
Baby, baby, baby ohh 
Like 
Baby, baby, baby noo 
Like 
Baby, baby, baby ohh 
I thought you'd always be mine 

And girl for you, I would have done whatever 
And I just can't believe we ain't together 
And I wanna play it cool 
But I'm losin you 
I'll buy you anything 
I'll buy you any ring 
Girl I'm in pieces 
Baby fix me 
And just shake me til you wake me from this bad dream 
I'm goin down, down, down 
And I just can't believe my first love won't be around 

[Chorus] 

And now I'm like 
Baby, baby, baby ohh 
Like 
Baby, baby, baby noo 
Like 
Baby, baby, baby ohh 
I thought you'd always be mine, mine 
Baby, baby, baby ohh 
Like 
Baby, baby, baby noo 
Like 
Baby, baby, baby ohh 
I thought you'd always be mine 

(Ludacris) 

Luda, when I was 13, I had my first love 
There was nobody that compare to my baby 
Ain't nobody come between us 
Or could ever come above 

She had me going crazy 
Oh I was starstruck 
She woke me up daily 
Don't need no Starbucks 

She make my heart pound 
And skip a beat when I see her in the street 
And at school on the playground 

But I really wanna see her on the weekends 
She know she got me dazing 
Oh she was so amazing 
And now my heart is breaking 
But I just keep on saying 

[Chorus] 

Baby, baby, baby ohh 
Like 
Baby, baby, baby noo 
Like 
Baby, baby, baby ohh 
I thought you'd always be mine, mine 
Baby, baby, baby ohh 
Like 
Baby, baby, baby noo 
Like 
Baby, baby, baby ohh 
I thought you'd always be mine, mine 

I'm gone 
Yeahh, yeah, yeah 
Now "
6,Dynamite,Taio Cruz,"I came to dance, dance, dance, dance
I hit the floor
'Cause that's my, plans, plans, plans, plans
I'm wearing all my favorite
Brands, brands, brands, brands
Give me space for both my hands, hands, hands, hands
You, you
Cause it goes on and on and on
And it goes on and on and on

I throw my hands up in the air sometimes
Saying AYO
Gotta let go
I wanna celebrate and live my life
Saying AYO
Baby, let's go

'Cause we gon' rock this club
We gon' go all night
We gon' light it up
Like it's dynamite
Cause I told you once
Now I told you twice
We gon' light it up
Like it's dynamite

I came to move, move, move, move
Get out the way me and my crew, crew, crew, crew
I'm in the club so I'm gonna do, do, do, do
Just drop the phone, came here to do, do, do, do

Yeah, yeah

Cause it goes on and on and on
And it goes on and on and on

I throw my hands up in the air sometimes
Saying AYO
Gotta let go
I wanna celebrate and live my life
Saying AYO
Baby, let's go

'Cause we gon' rock this club
We gon' go all night
We gon' light it up
Like it's dynamite
Cause I told you once
Now I told you twice
We gon' light it up
Like it's dynamite

I'm gonna take it all out
I'm gonna be the last one standing
I'm alone and all I
I'm gonna be the last one landing
'Cause I, I, Believe it
And I, I, I
I just want it all
I'm gonna put my hands in the air
Hands in the air
Put your hands in the air

I throw my hands up in the air sometimes
Saying AYO
Gotta let go
I wanna celebrate and live my life
Saying AYO
Baby, let's go

'Cause we gon' rock this club
We gon' go all night
We gon' light it up
Like it's dynamite
Cause I told you once
Now I told you twice
We gon' light it up
Like it's dynamite"
7,Secrets,OneRepublic,
8,Empire State of Mind (Part II) Broken Down,Alicia Keys,"Ooo baby
there's somthing that I gotta tell ya
Baby you should know
What's on my mind

Now ooo baby
I'm feelin our situation
It's gettin stronger
How we wanted
But i gotta take my time

(Bridge)
See there so much about you
That I want to explore
Physical attraction
We just can't ignore it
But before we got too far across the line
Gotta really make sure that i'm sure

(Chorus)
Slow down babe
Let take our time
SLow down babe
If you don't mind
Slow down babe
Before we make this move
Slow down babe
baby slow down
(i Think it's really too soon)

Ooo baby
It's like I've known you forever
My medula obligada is electrified
ooo ooo baby
whenever we're alone together
I'm about to explode and it feels so right
but i gotta take my time

Bridge & chorus

See I know what is best
cause I've been there before
gave myself to someone
for all the wrong reasons
But this time around
I don't wanna do that again
I just wanna make this
the way that i've dreamed of
So baby you got ta...

Chorus"
9,Only Girl (In The World),Rihanna,"We stay moving around solo
Ask us where you at, we don’t know
And don’t care (don’t care)
All we know is we was at home 'cause you left us there
You got your boys and got gone and left us all alone
Now she in the club with a freaky dress on
Cats don't want her to keep that dress on
Tryna get enough drinks in her system
Take her to the telly and make her a victim

Patrón on the brain
Ball player in her face
They shake the spot
She’s just another cake

Easy for a good girl to go bad
And once we gone
Best believe we gone forever
Don’t be the reason
Don’t be the reason
You better learn how to treat us right
'Cause once a good girl goes bad
We die forever

He steady with a flock of 'em, oh yeah
Got a girl at home but he don’t care
Won’t care (won't care), all you do is keep me at home
Won’t let me go nowhere
He thinks because I’m at home
I won’t be gettin’ it on
And now I'm finding numbers
In the jacket pockets
Chicks calling the house non-stop
It’s getting out of control
Finally I can’t take no more
He finds a letter on the stairs
Saying this is the end
I packed my bag and left with your best friend

Easy for a good girl to go bad
And once we gone
Best believe we gone forever
Don’t be the reason
Don’t be the reason
You better learn how to treat us right
'Cause once a good girl goes bad
We die forever

We stay moving around solo
Ask us where you at, we don’t know
And don’t care (don't care)
All we know is we was at home 'cause you left us there
You got your boys and got gone and left us all alone

Easy for a good girl to go bad
And once we gone
Best believe we gone forever
Don’t be the reason
Don’t be the reason
You better learn how to treat us right
'Cause once a good girl goes bad
We die forever

We gone forever
We gone forever"
10,Club Can't Handle Me (feat. David Guetta),Flo Rida,"Mhmhmhmhmhmhm
Let me talk to 'em
Let me talk to 'em

Let it ring
Mhmhmhmhmhmhm
Let me talk to 'em
Come on

[Chorus:]
Shawty had them Apple Bottom Jeans [Jeans]
Boots with the fur [With the fur]
The whole club was lookin at her
She hit the floor [She hit the floor]
Next thing you know
Shawty got low low low low low low low low

Them baggy sweat pants
And the Reeboks with the straps [With the straps]
She turned around and gave that big booty a slap [hey]
She hit the floor [She hit the floor]
Next thing you know
Shawty got low low low low low low low low

[Verse 1:]
I ain't never seen nuthin that'll make me go,
This crazy all night spendin my dough
Had a million dollar vibe and a bottle to go
Dem birthday cakes, they stole the show
So sexual, she was flexible
Professional, drinkin X and ooo
Hold up wait a minute, do I see what I think I
Whoa
Did I think I seen Shawty get low
Ain't the same when it's up that close
Make it rain, I'm makin it snow
Work the pole, I got the bank roll
Imma say that I prefer them no clothes
I'm into that, I love women exposed
She threw it back at me, I gave her more
Cash ain't a problem, I know where it goes

She had them

[Chorus:]
Apple Bottom Jeans [Jeans]
Boots with the fur [With the fur]
The whole club was lookin at her
She hit the floor [She hit the floor]
Next thing you know
Shawty got low low low low low low low low

Them baggy sweat pants
And the Reeboks with the straps [With the straps]
She turned around and gave that big booty a smack
[Ayy]
She hit the floor[She hit the floor]
Next thing you know
Shawty got low low low low low low low low

[Verse 2:]
Hey
Shawty what I gotta do to get you home
My jeans full of gwap
And they ready for Shones
Cadillacs Maybachs for the sexy grown
Patrone on the rocks that'll make you moan

One stack (come on)
Two stacks (come on)
Three stacks (come on, now that's three grand)
What you think I'm playin baby girl
I'm the man, I'll bend the rubber bands

That's what I told her, her legs on my shoulder
I knew it was ova, that Henny and Cola
Got me like a Soldier
She ready for Rover, I couldn't control her
So lucky oo me, I was just like a clover
Shawty was hot like a toaster
Sorry but I had to fold her,
Like a pornography poster
She showed her

[Chorus:]
Apple Bottom Jeans [Jeans]
Boots with the fur [With the fur]
The whole club was lookin at her
She hit the floor[She hit the floor]
Next thing you know
Shawty got low low low low low low low low

Them baggy sweat pants
And the Reeboks with the straps [With the straps]
She turned around and gave that big booty a smack [Ayy]
She hit the flo [She hit the flo]
Next thing you know
Shawty got low low low low low low low low

[Verse 3:]
Whoa
Shawty
Yea she was worth the money
Her mama took my cash,
and I ain't want it back,
The way she bit that rag,
got her them paper stacks,
Tattoo Above her crack,
I had to handle that,

I was on it, sexy woman, let me shownin
They be want it two in the mornin
I'm zonin in them rosay bottles foamin
She wouldn't stop, made it drop
Shawty did that pop and lock,
Had to break her off that gwap
Gah it was fly just like my glock

[Chorus:]
Apple Bottom Jeans [Jeans]
Boots with the fur [With the fur]
The whole club was lookin at her
She hit the floor[She hit the floor]
Next thing you know
Shawty got low low low low low low low low

Them baggy sweat pants
And the Reeboks with the straps [With the straps]
She turned around and gave that big booty a smack [Ayy]
She hit the floor[She hit the floor]
Next thing you know
Shawty got low low low low low low low low

C'mon"
11,Marry You,Bruno Mars,
12,Cooler Than Me - Single Mix,Mike Posner,
13,Telephone,Lady Gaga,"Hello hello baby you called
I can’t hear a thing
I have got no service
In the club, you say? say?
Wha-wha-what did you say huh?
You’re breakin’ up on me
Sorry I cannot hear you
I’m kinda busy
K-kinda busy
K-kinda busy
Sorry I cannot hear you I’m kinda busy

Just a second
It’s my favorite song they’re gonna play
And I cannot text you with a drink in my hand, eh?
You shoulda made some plans with me
You knew that I was free
And now you won’t stop calling me
I’m kinda busy

Stop callin’
Stop callin’
I don’t wanna think anymore
I got my head and my heart on the dancefloor
Stop callin’
Stop callin’
I don’t wanna talk anymore
I got my head and my heart on the dancefloor

E-e-e-e-e-e-e-e-e-e-e
Stop telephonin’
Me-e-e-e-e-e-e-e-e-e-e
I’m busy e-e-e-e-e-e-e-e-e-e
Stop telephonin’
Me-e-e-e-e-e-e-e-e-e-e
Can call all you want but there’s no one home
And you’re not gonna reach my telephone

‘Cuz I’m out in the club
And I’m sippin that bubb
And you’re not gonna reach my telephone

Boy why you blown up my phone
Won’t make me leave no faster
Put my coat on faster
Leave my girls no faster
I shoulda left my phone at home
‘Cuz this is a disaster
Calling like a collector
Sorry, I can’t answer

Not that I don’t like you
I’m just at a party
And I am sick and tired of my phone r-ringing
Sometimes I feel like I live in grand central station
Tonight I’m not takin’ no calls
‘Cuz I’ll be dancin’

Stop callin’
Stop callin’
I don’t wanna think anymore
I got my head and my heart on the dancefloor
Stop callin’
Stop callin’
I don’t wanna talk anymore
I got my head and my heart on the dancefloor

E-e-e-e-e-e-e-e-e-e-e
Stop telephonin’
Me-e-e-e-e-e-e-e-e-e-e
I’m busy e-e-e-e-e-e-e-e-e-e
Stop telephonin’
Me-e-e-e-e-e-e-e-e-e-e
Can call all you want but there’s no one home
And you’re not gonna reach my telephone

‘Cuz I’m out in the club
And I’m sippin that bubb
And you’re not gonna reach my telephone
My telephone
Ma ma ma telephone
‘Cuz I’m out in the club
And I’m sippin that bubb
And you’re not gonna reach my telephone"
14,Like A G6,Far East Movement,
15,OMG (feat. will.i.am),Usher,"Usher:
Peace up!
A Town Down!

Lil Jon: Yeah, okay! Lil Jon!

Usher:
Yeah, Yeah Yeah, Yeah yeah, Yeaah
Yeah, Yeah yeah, Yeah yeah, Yeaah

Usher:
I'm in the club with my homies
Tryin' to get a little V-I
Keep it down on the low key
Cause you know how it feels
I said shorty she was checkin' up on me
From the game she was spittin' my ear
You would think that she knew me
So we decided to chill

Conversation got heavy
She had me feelin like she's ready to blow!
Watch out! Watch out!
She was saying come get me, come get me
So I got up and followed her to the floor
She said baby let's go
When I told her I said

CHORUS: (Usher)
Yeah yeah Shorty got down and said come and get me
Yeah yeah I got so caught up I forgot she told me
Yeah yeah Her and my girl used be the best of homies
Yeah yeah Next thing I knew she was all up on me screaming
Yeah, Yeah yeah, Yeah yeah, Yeaah
Yeah, Yeah yeah, Yeah yeah, Yeaah

Usher:
She's all up in my head now
Got me thinking that it might
Be a good idea to take her with
Me, cause she's ready to leave
Now I gotta keep it real now
Cause on a 1-to-10
She's a certified twenty
And that just ain't me

Cause I do know if I take that chance
Just where is it gonna lead
But what I do know is the way she dance
Makes shorty all right with me
The way she getting low!
I'm like yeah, just work that out for me
She asked for one more dance and
I'm like yeah
How am I supposed to leave?
And I said

(CHORUS)

Lil Jon: Luda!

Ludacris::
Watch out! My outfit's ridiculous
In the club lookin so conspicuous
And Rowl! These women all on the prowl
If you hold the head steady, I'm a milk the cow
Forget about the game, I'm a spit the truth
I won't stop till I get em in they birthday suits
So gimme the rhythm and it'll be off with they clothes
Then bend over to the front and touch your toes!
I left the jag and I took the rolls
If they ain't cutting then I put em on foot patrol
How you like me now
When my pinky's valued over three hundred thousand
Let's drink, you the one to please
Ludacris feel cups like double D's
Me and Ursh once more and we leave em dead
We want a lady in the street but a freak in the bed to say

(CHORUS)

Ludacris:
Take that and rewind it back
Lil Jon got the beat to make ya booty go (clap)
Take that and rewind it back
Ursher got the voice to make ya booty go (clap)
Take that and rewind it back
Ludacris got the flow to make ya booty go (clap)
Take that and rewind it back
Lil Jon got the beat to make ya booty go (clap)"
16,Eenie Meenie,Sean Kingston,
17,The Time (Dirty Bit),The Black Eyed Peas,"The neon lights are shining on me again
I walk the lonely streets in search of a friend
I need a lady to help me to get through the night, through the night
If I could find one then everything would be alright

The sleepy city is dreaming the night time away
Out on the street I watch tomorrow becoming today
I see a man, he's got take away women for sale, yes for sale
Guess that's the answer, 'cause take away women don't fail

Oh dirty women, they don't mess around
Oh dirty women, they don't mess around
You've got me coming, You've got me going around
Oh dirty women, they don't mess around

Walking the streets I wonder will it ever happen
Gotta be good 'cause then everything will be OK
If I could score tonight then I will end up happy

A woman for sale is gonna help me save my day..."
18,Alejandro,Lady Gaga,"She's got both hands in her pockets
And she won't look at you, won't look at you
She hides true love, en su bolsillo
She's got a halo around her finger around you

You know that I love you, boy
Hot like Mexico, rejoice
At this point I gotta choose
Nothing to lose

Don't call my name, don't call my name, Alejandro
I'm not your babe, I'm not your babe, Fernando
Don't wanna kiss, don't wanna touch
Just smoke one cigarette and hush
Don't call my name, don't call my name, Roberto

Alejandro, Alejandro
Ale-Alejandro, Ale-Alejandro
Alejandro, Alejandro
Ale-Alejandro, Ale-Alejandro

Stop please, just let me go
Alejandro, just let me go

She's not broken, she's just a baby
But her boyfriend's like a dad, just like a dad
And all those flames that burned before him
Now he's gonna firefight, got cool the bad

You know that I love you, boy
Hot like Mexico, rejoice
At this point I gotta choose
Nothing to lose

Don't call my name, don't call my name, Alejandro
I'm not your babe, I'm not your babe, Fernando
Don't wanna kiss, don't wanna touch
Just smoke one cigarette and hush
Don't call my name, don't call my name, Roberto

Alejandro, Alejandro
Ale-Alejandro, Ale-Alejandro
Alejandro, Alejandro
Ale-Alejandro, Ale-Alejandro

Don't bother me, don't bother me, Alejandro
Don't call my name, don't call my name, bye Fernando
I'm not your babe, I'm not your babe, Alejandro
Don't wanna kiss, don't wanna touch, Fernando

Don't call my name, don't call my name, Alejandro
I'm not your babe, I'm not your babe, Fernando
Don't wanna kiss, don't wanna touch
Just smoke one cigarette and hush
Don't call my name, don't call my name, Roberto

Alejandro, Alejandro
Ale-Alejandro, Ale-Alejandro
Alejandro, Alejandro
Ale-Alejandro, Ale-Alejandro

Don't call my name, don't call my name, Alejandro
(Alejandro, Alejandro)
nI'm not your babe, I'm not your babe, Fernado
(Ale-Alejandro, Ale-Alejandro)
Don't wanna kiss, don't wanna touch
(Alejandro, Alejandro)
Just smoke one cigarette and hush
Don't call my name, don't call my name, Roberto
(Ale-Alejandro, Ale-Alejandro)
Alejandro"
19,Your Love Is My Drug,Kesha,
