,title,artist,lyrics
397,Hands To Myself,Selena Gomez,"I wear the same shoes as everyone
I got the same blues as everyone
So try and call me, I'm immobile man
Yes I am

Got a haircut, got a silver tooth
Gonna get myself arrested
Got some friends in my BMW
Tryin'a get themselves arrested

I suck the same lines as anyone
I do the same time as anyone
Don't try and call me, I'm immobile man
Yes I am

Got a haircut, got a silver tooth
Gonna get myself arrested
Got some friends in my BMW
Tryin'a get themselves arrested

He only grows for guys he knows and me
He only grows for guys he knows and me
Well, alright

Don't try and call me, I'm immobile man
Don't try and call me, I'm immobile man
Yes I am

Got a haircut, got a silver tooth
Gonna get myself arrested
Got some friends in my BMW
Tryin'a get themselves arrested

Got no time for the selfish me and you's
Tryin'a get myself arrested"
398,All I Ask,Adele,
399,"Just Like Fire (From the Original Motion Picture ""Alice Through The Looking Glass"")",P!nk,
400,NO,Meghan Trainor,
401,Kill Em With Kindness,Selena Gomez,
402,Cool Girl,Tove Lo,
403,Runnin' (Lose It All),Naughty Boy,"Oh no
Take what you need 'cause I can't hold my breath
Say what you feel 'cause I got nothing left, oh
I made a promise to myself last night
I'm gonna keep it if it's wrong or right

And if I lose it all
There'll be nothing left to lose and I would take the fall
'Cause knowing you are out there breathing
It's so wonderful, it's a chance I take even if I break it
I lose it all, if I lose it all
Wouldn't matter anyway

Don't change a thing, perfect as you are
Time has a way, time is all I've got
If my heart should shatter watching you
That'd be one less thing I'd have to prove

And if I lose it all
There'll be nothing left to lose and I would take the fall
'Cause knowing you are out there breathing
It's so wonderful, it's a chance I take even if I break it
I lose it all, if I lose it all

Heaven will be waiting when I fall into your open arms
I believe you'll find me there
You'll find me there

And if I lose it all
There'll be nothing left to lose and I would take the fall
'Cause knowing you are out there breathing
It's so wonderful, it's a chance I take even if I break it
I lose it all, if I lose it all

And if I lose it all
There'll be nothing left to lose and I would take the fall
'Cause knowing you are out there breathing
It's so wonderful, it's a chance I take even if I break it
I lose it all, if I lose it all
Wouldn't matter anyway"
404,Here,Alessia Cara,
405,Perfect Illusion,Lady Gaga,
406,PILLOWTALK,ZAYN,
407,Out Of The Woods,Taylor Swift,
408,Rise,Katy Perry,
409,Wherever I Go,OneRepublic,
410,Body Say,Demi Lovato,
411,Don't Be A Fool,Shawn Mendes,"Day after day, alone on the hill,
The man with the foolish grin is keeping perfectly still.
But nobody wants to know him,
They can see that he's just a fool.
And he never gives an answer .....
But the fool on the hill,
Sees the sun going down.
And the eyes in his head,
See the world spinning around.
Well on his way, his head in a cloud,
The man of a thousand voices, talking perfectly loud.
But nobody ever hears him,
Or the sound he appears to make.
And he never seems to notice .....
But the fool on the hill,
Sees the sun going down.
And the eyes in his head,
See the world spinning around.
And nobody seems to like him,
They can tell what he wants to do.
And he never shows his feelings,
But the fool on the hill,
Sees the sun going down.
And the eyes in his head,
See the world spinning around"
412,LIKE I WOULD,ZAYN,
413,Cheap Thrills,Sia,
414,I Got You,Bebe Rexha,
415,Run Away With Me,Carly Rae Jepsen,"We're coming to the edge
running on the water
coming through the fog
your sons and daughters

Let the river run
let all the dreamers wake the nation
Come, the New Jerusalem.

Silver cities rise
the morning lights the streets that lead them
and sirens call them on with a song

It's asking for the taking
trembling
shaking
Oh, my heart is aching

We're coming to the edge
running on the water
coming through the fog
your sons and daughters

We the great and small
stand on a star
and blaze a trail of desire
through the darkening dawn

It's asking for the taking
Come run with me now
the sky is the color of blue
you've never even seen
in the eyes of your lover

Oh, my heart is aching
We're coming to the edge
running on the water
coming through the fog
your sons and daughters

It's asking for the taking
trembling, shaking
Oh, my heart is aching

We're coming to the edge
running on the water
coming through the fog
your sons and daughters

Let the river run
let all the dreamers
wake the nation
Come, the New Jerusalem"
416,Cruel (feat. ZAYN),Snakehips,
417,Send My Love (To Your New Lover),Adele,"This was all you
 None of it me
 You put your hands all over my body and told me
 You told me you were ready
 For the big one
 For the big jump
 I be your last love everlasting you and me
 That was what you told me

 I'm giving you up
 I've forgiven it all
 
 (You set me free, ohhhhh)

 Send my love to your new lover
 Treat her better
 We gotta let go of all of our ghosts
 We both know we ain't kids no more
 Send my love to your new lover
 Treat her better
 We gotta let go of all of our ghosts
 We both know we ain't kids no more

 I was too strong you were trembling
 You couldn't handle the hot heat rising
 Rising...
 Baby I'm so rising
 I was running, you were walking
 You couldn't keep up, you were falling down
 Down...
 Mmm there's only one way down

 I'm giving you up
 I've forgiven it all
 You set me free, ohhhh

 Send my love to your new lover
 Treat her better
 We gotta let go of all of our ghosts
 We both know we ain't kids no more
 Send my love to your new lover
 Treat her better
 We gotta let go of all of our ghosts
 We both know we ain't kids no more

 If you're ready, if you're ready
 If you're ready, I am ready
 If you're ready, if you're ready
 We both know we ain't kids no more
 No, we ain't kids no more

 I'm giving you up
 I've forgiven it all
 You set me free, ohhhh

 Send my love to your new lover
 Treat her better
 We gotta let go of all of our ghosts
 We both know we ain't kids no more
 Send my love to your new lover
 Treat her better
 We gotta let go of all of our ghosts
 We both know we ain't kids no more

 If you're ready, if you're ready
 (Send my love to your new lover)
 If you're ready, are you ready?
 Treat her better...
 We've gotta let go of all of our ghosts
 We both know we ain't kids no more

 If you're ready, if you're ready
 (Send my love to your new lover)
 If you're ready, are you ready?
 Treat her better...
 We've gotta let go of all of our ghosts
 We both know we ain't kids no more"
418,WTF (Where They From),Missy Elliott,
419,Desire,Years & Years,
420,When We Were Young,Adele,
421,I Know What You Did Last Summer,Shawn Mendes,"I don't know why
The sky is so blue
And I don't know why
I'm so in love with you
But if there were no music
Then I would not get through
I don't know why
I know these things, but I do

I don't know why
But somewhere dreams come true
And I don't know where
But there will be a place for you
And every time you look that way
I would lay down my life for you
I don't know why
I know these things, but I do

I don't know why
But some are going to make you cry
And I don't know how
But I will get you by, I will try
They're not trying to cause you pain
They're just afraid of loving you
I don't know why
I know these things, but I do

I don't know why
The trees grow so tall
And I don't know why
I don't know anything at all
But if there were no music
Then I would not get through
I don't know why
I know these things, but I do
I don't know why
I know these things, but I do"
422,Wish That You Were Here - From Miss Peregrines Home for Peculiar Children Original Motion Picture,Florence + The Machine,"Hungry people dont stay hungry for long
They get hope from fire and smoke as the wheat grows strong

Tha spirit of Jackson
Now screams through tha ruins
Through factory chainsAnd tha ghost of tha union
Forgotten remains
Disappear to their new homes
Tha knife tha thrust
Tha life burns to the raw bone
Tha blood on the floor of the tear is still dryin
Cover the spread sheets
Tha Dow Jones skyin
Cell block live stock
Tha bodies their buyin
Old south order
New northern horizon

Violence in all hands
Embrace it if need be
Livin been warfare
I press it to CD

A fire in the masters house is set

Check tha high tech terror
Yes tha new order athletes
Peer into tha eyes of tha child already on trial
Armies rippin families apart
Get em on file
Convictions fit tha stock profile
All tha while films of dogs
Cutting through homes
Ripping skin from bones
Yes tha new millennium homes
Privatizing through private eyes
An era rising
Of tha old south order
New northern horizon
Violence in all hands
Embrace it if need be
Livin been warfare
I press it to CD

Violence in all hands
Embrace it if need be
Livin been warfare
I press it to CD

A fire in the masters house is set"
423,Hurts,Emeli Sandé,
424,Change,Christina Aguilera,
425,Make Me... (feat. G-Eazy),Britney Spears,"All my people in the crowd
Grab a partner take it down!

[B:] It's me against the music
[M:] Uh uh
[B:] It's just me
[M:] And me
[B:] Yeah
[M:] C'mon
[M:] Hey Britney?
[B:] Are you ready?
[M:] Uh uh, are you?

[B&M:] No one cares
[B:] It's whippin'my hair, it's pullin' my waist
[B&M:] To hell with stares
[B:] The sweat is drippin' all over my face
[B&M:] No one's there
[B:] I'm the only one dancin' up in this place
[B&M:] Tonight I'm here
[B:] Feel the beat of the drum, gotta keep it that bass
[B:] I'm up against the speaker, tryin' to take on the music
[B:] It's like a competition, me against the beat
[B:] I wanna get in the zone, I wanna get in the zone
[B:] If you really wanna battle, saddle up and get your rhythm
[B:] Tryin' to hit it, you could die
[B:] In a minute I'm a take a you on, I'm a take a you on
Hey, hey, hey

[B&M:] All my people on the floor
[B:] Let me see you dance
[M:] Let me see ya
[B&M:] All my people wantin' more
[B:] Let me see you dance
[M:] I wanna see ya
[B&M:] All my people round and round
[B:] Let me see you dance
[M:] Let me see ya
[B&M:] All my people in the crowd
[B:] Let me see you dance
[M:] I wanna see ya
[B&M:] So how would you like a friendly competition
[B&M:] Let's take on the song
[B&M:] It's you and me baby, we're the music
[B&M:] Time to party all night long

[B&M:] We're almost there
[B:] I'm feelin' it bad and I can't explain
[B&M:] My soul is bare
[B:] My hips are movin' at a rapid pace
[B&M:] Baby feel it burn
[B:] From the tip of my toes, runnin' through my veins
[B&M:] And now it's your turn
[B:] Let me see what you got, don't hesitate
[B:] I'm up against the speaker, tryin' to take on the music
[B:] It's like a competition, me against the beat
[B:] I wanna get in the zone, I wanna get in the zone
[B:] If you really wanna battle, saddle up and get your rhythm
[B:] Tryin' to hit it, you could die
[B:] In a minute I'm a take a you on, I'm a take a you on
Hey, hey, hey

[B&M:] All my people on the floor
[B:] Let me see you dance
[M:] Let me see ya
[B&M:] All my people wantin' more
[B:] Let me see you dance
[M:] I wanna see ya
[B&M:] All my people round and round
[B:] Let me see you dance
[M:] Let me see ya
[B&M:] All my people in the crowd
[B:] Let me see you dance
[M:] I wanna see ya
[B&M:] So how would you like a friendly competition
[B&M:] Let's take on the song
[B&M:] It's you and me baby, we're the music
[B&M:] Time to party all night long

[B&M:] Get on the floor, baby lose control
[B&M:] Just work your body and let it go
[B&M:] If you wanna party, just grab somebody
[M:] Hey Britney
[B&M:] We can dance all night long

M:] Hey Britney, you say you wanna lose control
[M:] Come over here I got somethin' to show ya
[M:] Sexy lady, I'd rather see you bare your soul
[M:] If you think you're so hot, better show me what you got
[M:] All my people in the crowd, let me see you dance
[M:] C'mon Britney lose control, watch you take it down

B&M:] Get on the floor, baby lose control
[B&M:] Just work your body and let it go
[B&M:] If you wanna party, just grab somebody
[M:] Hey Britney
[B&M:] We can dance all night long

[B&M:] All my people on the floor
[B:] Let me see you dance
[M:] Let me see ya
[B&M:] All my people wantin' more
[B:] Let me see you dance
[M:] I wanna see ya
[B&M:] All my people round and round
[B:] Let me see you dance
[M:] Let me see ya
[B&M:] All my people in the crowd
[B:] Let me see you dance
[M:] I wanna see ya
[B&M:] So how would you like a friendly competition
[B&M:] Let's take on the song
[B&M:] It's you and me baby, we're the music
[B&M:] Time to party all night long

M:] All my people in the crowd, let me see you dance
[M:] C'mon Britney take it down, make the music dance
[M:] All my people round and round, party all night long
[M:] C'mon Britney lose control, watch you take it down"
426,Keeping Your Head Up,Birdy,
427,True Colors,Zedd,
428,Make Me Like You,Gwen Stefani,
429,Champagne Problems,Nick Jonas,
430,Blown,DNCE,
431,Start,John Legend,"Our life together is so precious together
We have grown, we have grown
Although our love is still special
Let's take a chance and fly away somewhere alone
It's been too long since we took the time
No-one's to blame, I know time flies so quickly
But when I see you darling
It's like we both are falling in love again
It'll be just like starting over, starting over

Everyday we used to make it love
Why can't we be making love nice and easy
It's time to spread our wings and fly
Don't let another day go by my love
It'll be just like starting over, starting over

Why don't we take off alone
Take a trip somewhere far, far away
We'll be together all alone again
Like we used to in the early days
Well, well, well darling

It's been too long since we took the time
No-one's to blame, I know time flies so quickly
But when I see you darling
It's like we both are falling in love again
It'll be just like starting over, starting over

Our life together is so precious together
We have grown, we have grown
Although our love is still special
Let's take a chance and fly away somewhere

Starting over"
432,Pep Rally,Missy Elliott,
433,Higher,Carly Rae Jepsen,
434,Invitation,Britney Spears,
435,One Call Away (feat. Tyga) - Remix,Charlie Puth,
436,Beautiful Birds (feat. Birdy),Passenger,
437,Little Lies,Hilary Duff,"I won't tell you what I'm thinkin'
Cause it's not the same thing you're thinking too
You could say I've got a best friend
And she's always telling me what to do

She's out of sight, but easy to find
She's in the front of my mind

The little voice in my head won't let me forget
The little voice in my head is never misled
All of this noise is what keeps me from making a mess
The little vioce in my head just won't let me get with you

La la la la la la la la la la la la la la la la la la la la la

When I see you, I admit I start to lose my grip and all of my cool
You smell so sweet, just like my perfume
What have you been doing since I left you
You're always there in my thoughts, but that doesn't mean that it's on

The little voice in my head won't let me forget
The little voice in my head is never misled
All of this noise is what keeps me from making a mess
The little voice in my head just won't let me get with you

La la la la la la la la la la la la la la la la la la la la la

I know I sound insane, like I'm playing games
Cause all I really want is you
But there's somethings a girl won't do
(Oooooooo)

The little voice
The little voice

The little voioce in my head won't let me forget
The little voice in my head is never misled
All of this noise is what keeps me from making a mess
The little voice in my head just won't let me get with you

la la la la la la la la la la la la la la la la la la la la la la la la la la la la la la la la la la la la la la la la la la la"
438,Do You Wanna Come Over?,Britney Spears,
439,BURNITUP!,Janet Jackson,
440,Picky - Remix,Joey Montana,
441,Behind Your Back,Nelly Furtado,"Yeah, that's tight (uh)
Check it, drop the drum right (hmmm..yeah)
Put some horns in it..woo! (that's right)
Do it again (yeah yeah, ha oooh oooh alright, ha)
Give her what she want, give her what she want uh [repeat]

[Verse 1: Xtina]
I see you lookin', uh
like what you see?
Boy, now don’t be shy
and look at her face in opportunity

[Nelly (Xtina):]
She’s right ya know (uh uh), she's right (ah)
Man, she's right ya know (uh uh), she's right (ow!)
You stand there looking at me (at me)
I stand herre looking at you girl (at you boy)
You know exactly what's on my mind (yeah yeah)

[Xtina (Nelly):]
It’s just so easy to see (to see)
You came here looking for me (but uh uh)
But I don’t do that type of thing all the time, yeah
(You want me to)
Come here boy
I got a little something for ya
(You got a little bit, can I get a little bit? yeah yeah)
And I don’t know (I don't know what it is but I just want to get to know ya, alright alright..yeah yeah)

[Chorus:]
I need to daaaaaance
(Tilt ya head back, take ya head back)
All night
(Bring it back up slowly, that's right)
I need ya to daaaaaance
(Tilt ya head back, take ya head back)
All night
(Bring it back up slowly, that's right)

[Verse 2: Nelly]
Now situations, girl
They often change
Sometimes for the good
Sometimes for the bad, but who’s to blame?

[Xtina (Nelly):]
He’s right ya know (uh uh), he's right (oh babygirl)
He's right ya know (uh uh), he's right, OW!

[Nelly (Xtina):]
You stand there looking at me (at me)
I stand herre looking at you girl (at you boy)
You know exactly what’s on my mind (yeah yeah)

[Xtina (Nelly):]
It’s just so easy to see (to see)
You came here looking for me (but uh uh)
But I don’t do that type of thing all the time, yeah
(You want me to)
Come here boy
I got a little something for ya
(You got a little bit, can I get a little bit? yeah yeah)
And I don’t know (I don't know what it is but I just want to get to know ya, alright alright..yeah yeah)

[Chorus:]
I need to daaaaaance
(Tilt ya head back, take ya head back)
All night
(Bring it back up slowly, that's right)
I need ya to daaaaaance
(Tilt ya head back, take ya head back)
All night
(Bring it back up slowly, that's right)

(Everybody says)
Hustle for me, hustle (hustle)
Hustle for me, hustle (hustle)
Hustle for me, hustle (hustle)
Hustle for me, yeah

[Verse 3: Xtina]
So, you got some nerve thinking you’re so
I got a little bit of that
A little bit of this
A little bit of back
With a little bit of *beep*

[Nelly (Xtina):]
You stand there looking at me (at me)
I stand herre looking at you girl (at you boy)
You know exactly what’s on my mind (yeah yeah)

[Xtina (Nelly):]
It’s just so easy to see (to see)
You came here looking for me (but uh uh)
But I don’t do that type of thing all the tiiiiiiiiiiiime
(You want me to)
Come here boy
I got a little something for ya
(You got a little bit, can I get a little bit? yeah yeah)
And I don’t know (I don't know what it is but I just want to get to know ya, alright alright..yeah yeah)

[Chorus:]
I need to daaaaaance
(Tilt ya head back, take ya head back)
All night
(Bring it back up slowly, that's right)
I need ya to daaaaaance
(Tilt ya head back, take ya head back)
All night
(Bring it back up slowly, that's right)

Hey! (Give her what she want, give her what she want uh) [repeat 'til end]
oooohooooh, oooh yea, ha!
Oh Nelly!
Nelly, Nelly, you make me so sweaty baby
yeayeayeayeayeayea OH!"
442,Million Years Ago,Adele,
443,Shape of You,Ed Sheeran,
444,Closer,The Chainsmokers,
445,Starboy,The Weeknd,
446,Treat You Better,Shawn Mendes,
447,That's What I Like,Bruno Mars,
448,Let Me Love You,DJ Snake,"At the count of three
I want everybody in the place to be
To make some noise if ya down with me
One, two, three

Hit me with the horns Tony
Keep makin' noise, keep makin' noise, yeah, oh...
Here we go now, here we go now, here we go now...
Here we go, here we go, now listen

Some of y'all might know this
And some of y'all don't (jam jam)
Some of y'all might be with this, and some of y'all won't
But listen, let me clear my throat
Oh, have mercy babe, Ha!
I hope ya don't mind, let me clear my throat

Special dedication going out to everybody here
In Bahama Bay in Philadelphia here we go now
Check it out, ah huh, ah huh, ah (God Damn)

Yeah, rock to the rhythm of the funky rhyme
So I can get this in just one more time
To the beat and ya don't quit
It's that ol' skool rap with that new skool hit
Peter Piper picked a pepper but Kool got the Run
And I can still rip up the house
Every God damn time I get on the mic, I go crazy
Peace out to Celo, Flex, and Doug Lazy
I bet 'cha never knew but now ya know
I'm the undisputed king of this disco
And I never let the mic, might not tire me no more
'cause DJ Kool rip up the whole damn floor

Now I'ma rap a rhyme with the greatest of ease
And swing it like the man on the flying trapeze
And if you don't like it you grab on these
And now I need some help from the maestro please

Jam, Ha! So look it here check the flavor of the rhythm
I wrote and while I got a chance here
Let me clear my throat oh, have mercy babe, ha!
I hope ya don't mind, let me clear my throat
I need these monitors right here
Music and the monitors, and it goes a little something
Like this here ah huh ah huh ah

Now if y'all wanna party like we do
If y'all wanna party like us, lemme hear ya say
Ah ah ah ah ah, if y'all wanna party like we do


If y'all wanna party like us lemme hear ya say
Ah ah ah ah ah ah ah ah
Now when I say uh, you say ah
Uh (crowd) Uh (crowd)
And now when I say hey, you say ha
Hey (crowd) hey (crowd)
Now when I say uh, you say ah
Uh (crowd) Uh (crowd)
Now when I say hey you say ha, hey (crowd)
Now when I say freeze you just freeze one time
When I say freeze y'all stop on a dime
When I say freeze you just freeze one time
When I say freeze y'all stop on a dime freeze

Now all the ladies in the place
If you got real hair, real fingernails
If you got a job, you going to school
And y'all need nobody to help you handle
Your business make some noise

One, two, three, come on now
When I say freeze you just freeze one time
When I say freeze y'all stop on a dime
When I say freeze you just freeze one time
When I say freeze y'all stop on a dime freeze

Now to all the brotha's in the place
That don't give a damn about what the ladies talking about
''cause you just trying to get chummy make some noise

Now, now, now, let me clear my throat
Oh, have mercy babe, ha!
I hope you don't mind, let me clear my throat
Special dedication going out to all the ladies
And all the brothers in here
Like to love y'all to death here

Ah huh ah huh ah (God damn)
Oh, lemme send my little shout outs here
Special dedication once again going out to everybody here
Bahama Bay in Philadelphia, we love y'all madly
Special dedication going out to Mellow T
Walt Reeder da' joiner, Don Mack, Charlie Mack, DJ Ran
Cosmic Kev, special dedication going out to Frank Steed
Al Orrizo Ice T, and if you're with me, if you're with me
I need some help from the music, from the maestro
Check it out somebody make some noise in this joint man"
449,I Feel It Coming,The Weeknd,
450,Mercy,Shawn Mendes,
451,Side To Side,Ariana Grande,
452,Stay,Zedd,
453,It Ain't Me (with Selena Gomez),Kygo,
454,Malibu,Miley Cyrus,
455,Something Just Like This,The Chainsmokers,
456,Rockabye (feat. Sean Paul & Anne-Marie),Clean Bandit,
457,I Dont Wanna Live Forever (Fifty Shades Darker),ZAYN,
458,My Way,Calvin Harris,
459,"I'm the One (feat. Justin Bieber, Quavo, Chance the Rapper & Lil Wayne)",DJ Khaled,"Baby you're all that I want
When you're lying here in my arms
Finding it hard to believe
We're in heaven

Oh, thinkin' 'bout our younger years
There was only you and me
We were young and wild and free
Now, nothing can take you away from me
We've been down that road before
But that's over now,
You keep me coming back for more

Baby, you're all that I want
When you're lying here in my arms
I'm finding it hard to believe,
We're in Heaven
And love is all that I need
And I found it there in your heart
It isn't too hard to see,
We're in heaven

Now, nothing can change what you mean to me
there's a lot that I could say
Just hold me now
Cause our love will light the way

Baby you're all that I want
When you're lying here in my arms
I'm finding it hard to believe,
We're in heaven
Love is all that I need
And I found it there in your heart
It isn't too hard to see,
We're In heaven

Now our dreams are coming true
Through the good times and the bad
I'll be standing there by you....

Love is all that I need
And I found it there in your heart
It isn't too hard to see,
We're in heaven

We're in heaven"
460,Praying,Kesha,
461,Despacito - Remix,Luis Fonsi,
462,The Greatest,Sia,
463,There for You,Martin Garrix,
464,Paris,The Chainsmokers,
465,Crying in the Club,Camila Cabello,
466,Mama,Jonas Blue,
467,Slide (feat. Frank Ocean & Migos),Calvin Harris,"(Roy Orbison/Chris Price)

When I saw you standing there on the street
I found myself by your side
I started wanting you again
There's just no way to hide from that old
Loving You feeling again
It's really got me reeling again
It only seems to stop to start all over again with you.

I remember how you'd always been
That certain look in your eyes
Your not easy to resist
But I just walked on by
With that loving old feeling again
It's really got me reeling again
Only seems to stop to start all over again with you
Loving you feeling with you
We were so close we were too far apart.

I gave you my love
I wanted your heart
Without yesterday haunting the way
Maybe we'd still be together
Sharing that loving you feeling again
It's really got me reeling again
Will it ever stop and not start over again
That loving you feeling again
No matter how much I try
This loving you feeling
It's taken such a long time to say goodbye
And getting over you is so hard to do
With this feeling loving you
That loving you feeling again..."
